{
  "$schema": "https://json-schema.org/draft/2020-12/schema",
  "title": "BPKB Patterns",
  "type": "array",
  "items": {
    "type": "object",
    "required": [
      "pattern_id",
      "pattern_name",
      "module_id",
      "description",
      "evidence_status",
      "source_required",
      "last_verified_at",
      "research_notes",
      "source_ids",
      "created_at",
      "updated_at"
    ],
    "properties": {
      "pattern_id": { "type": "string" },
      "pattern_name": { "type": "string" },
      "module_id": { "type": "string" },
      "description": { "type": "string" },
      "evidence_status": {
        "type": "string",
        "enum": ["hypothesis", "source_backed_pending", "source_backed", "cross_validated", "field_validated"]
      },
      "source_required": { "type": "boolean", "const": true },
      "last_verified_at": { "type": ["string", "null"], "format": "date" },
      "research_notes": { "type": "string" },
      "source_ids": { "type": "array", "items": { "type": "string" } },
      "created_at": { "type": "string", "format": "date-time" },
      "updated_at": { "type": "string", "format": "date-time" }
    },
    "additionalProperties": false
  }
}
